date,text
2021-07-30 12:04:05+00:00,"Hundreds of AI tools have been built to catch covid. None of them helped.    When covid-19 struck Europe in March 2020, hospitals were plunged into a health crisis that was still badly understood.  But there was data coming out of China, which had a four-month head start in the race to beat the pandemic. If machine-learning algorithms could be trained on that data to help doctors understand what they were seeing and make decisions, it just might save lives. That was the hope.  “I thought, ‘If there’s any time that AI could prove its usefulness, it’s now,’” says Laure Wynants, an epidemiologist at Maastricht University in the Netherlands, who studies predictive tools.  It never happened. The AI community rushed to develop software that many believed would allow hospitals to diagnose or triage patients faster, bringing much-needed support to the front lines.  In the end, many hundreds of predictive tools were developed. None of them made a real difference, and some were potentially harmful.  That’s the damning conclusion of multiple studies published in the last few months. But there's still hope for the future. "
2021-07-28 12:35:51+00:00,"What you need to know about the CDC’s new mask guidelines    The news: The US Centers for Disease Control and Prevention has recommendedthat vaccinated people wear masks in public indoor spaces in communities where covid cases are spiking. It’s also recommended that children in grades K–12 attend school in person while continuing to wear masks inside.  Why now? It’s only two months since the CDC said fully vaccinated people mostly no longer needed to wear masks indoors, so this new policy may seem like backtracking. But the CDC’s director, Rochelle Walensky, said the decision is driven by the rising infections caused by the delta variant. In May, delta was responsible for just 2% of cases sequenced in the US. Now it’sover 90%. And although unvaccinated people are driving this spread, vaccinated people can also get sick and pass on infections.  Am I affected? Probably, if you live in the US. Much of the country is experiencing what the CDC calls “substantial transmission rates,” which means the new recommendation would apply. Visit the CDC’s Covid Data Trackerto check.  What next? The US vaccination rate needs to improve, and quickly. "
2021-07-27 12:03:36+00:00,"The pandemic slashed the West Coast’s emissions. Wildfires already reversed it.    The news: Wildfires raging across the US West Coast have filled the air with enough carbon dioxide to wipe out more than half of the region’s pandemic-driven emissions reductions last year. And that was just in July.  The pandemic effect: California, Idaho, Oregon, and Washington saw fossil fuel emissions decline by around 69 million tons of carbon dioxide last year as the pandemic slashed pollution from ground transportation, aviation, and industry.  But: From July 1 to July 25, fires in those states produced about 41 million tons of carbon dioxide, according to data from the European Commission’s Copernicus Atmosphere Monitoring Service.  The bigger picture: The numbers illustrate a troubling feedback loop. Climate change creates hotter, drier conditions that fuel increasingly frequent and devastating fires—which, in turn, release greenhouse gases that will drive further warming. The problem will likely grow worse in the coming decades across large parts of the globe.  What can be done? The good news is we do have some control over these forces. Nations can step up efforts to cut greenhouse-gas emissions as quickly as possible. And they can get more serious about halting deforestation while promoting tree-planting campaigns. "
2021-07-26 12:04:02+00:00,"Why researchers need to tinker with viruses    In May, the coronavirus researcher Ralph Baric found himself at the center of the debate over gain-of-function research, in which scientists engineer new properties into existing viruses. And during a congressional hearing, Senator Rand Paul implied that the National Institutes of Health had been funding such research at both the Wuhan Institute of Virology and Baric’s University of North Carolina lab, and that the two labs had been collaborating to make “superviruses.”  Baric released a statementclarifying the research in question did not qualify as gain-of-function, and none of the SARS-like coronaviruses he’d used in the experiments were closely related to SARS-CoV-2, yet that did little to quell questions about the role his research may have played in furthering scientists’ ability to modify coronaviruses in potentially dangerous ways.  Baric believes such research is essential to the development of vaccines and other countermeasures against emerging viruses, a project he has been engaged in for more than 20 years. His research laid the groundwork for the first approved anti-covid drug and helped speed the development of the mRNA vaccines that have proved so pivotal.  MIT Technology Review recently asked Baric to explain what constitutes a gain-of-function experiment, why such research exists, and whether it could have played any role in the pandemic. Read the full interview.  —Rowan Jacobsen  This story is for subscribers only. If you want access to it, and all of our other award-winning journalism, please do consider becoming a subscriber. Prices start at just $50 a yearfor digital access."
2021-07-26 12:04:02+00:00,"  Meet the people who warn the world about new covid variants  In March, when covid cases began spiking around India, Bani Jolly went hunting for answers in the virus’s genetic code. Jolly, a third-year PhD student at the CSIR Institute of Genomics and Integrative Biology in New Delhi, studied sequences of samples taken from around India. As she did, she found a cluster that didn’t look quite like any known variant.  She went to the place where a small group of scientists give new variants their names: a system called Pango, which has quietly become essential to global covid research. It’s staffed by a handful of volunteers around the world, led primarily by a PhD student in Scotland, and its software tools and naming system have now helped scientists worldwide understand and classify nearly 2.5 million samples of the virus.  The Pango team quickly came up with a new name for the variant Jolly had identified: B.1.167, also known as “delta.”  Researchers, public health officers, and journalists around the world use Pango to understand covid’s evolution. But few realize that the entire endeavor—like much in the new field of covid genomics—is powered by a tiny team of young researchers who have often put their own work on hold to build it. "
2021-07-23 12:03:38+00:00," structure of every protein known to science  Sponsored by Lumen Technologies (  The Download Your daily dose of what's up in emerging technology A deluge of pings 07.23.21 Happy Friday! Today we're looking at contact tracing app-related chaos in the UK, and an announcement from DeepMind that it's going to release the structure of every protein known to science. Get your friends to sign up hereto get The Download every day. I hope you have a good weekend!  Is the UK’s pingdemic good or bad? Yes.    Oscar Maung-Haley, 24, was working in a bar in Manchester, England, when his phone pinged. It was the UK’s NHS Test and Trace app letting him know he’d potentially been exposed to covid-19 and needed to self-isolate. The news immediately caused problems. “It was a mad dash around the venue to show my manager and say I had to go,” he says.  The alert he got was one of hundreds of thousands being sent out every weekas the UK battles its latest wave of covid, which means more and more people face the same challenges. The phenomenon is being dubbed a “pingdemic” on social media, blamed for everything from gas shortagesto bare store shelves.  The ping deluge reflects the collision of several developments: sharply rising cases due to the delta variant, record numbers of app downloads, and far more contact than before as the UK has dropped many of its lockdown restrictions. More infections, more users, more contact: more pings.  That’s exactly how the app is supposed to work, yet it’s causing a significant breakdown in the social contract, as a lack of clear, fair rules is leading to widespread frustration. "
2021-07-23 12:03:38+00:00,"  DeepMind says it will release the structure of every protein known to science  The news: DeepMind has announced that it has used its AI to predict the shapes of nearly every protein in the human body, as well as the shapes of hundreds of thousands of other proteins found in 20 of the most widely studied organisms, including yeast, fruit flies, and mice.  The details: So far the trove consists of 350,000 newly predicted protein structures. DeepMind says it will predict and release the structures for more than 100 million more in the next few months—more or less all proteins known to science.  Why it matters: The breakthrough could allow biologists from around the world to understand diseases better and develop new drugs. "
2021-07-22 12:03:39+00:00,"The impact of the pandemic on online activism    For the past year, people in the United States were supposed to live at a distance and keep to themselves to prevent the spread of a deadly virus. At the same time, there was a nationwide reckoning on systemic racism and inequality, a contentious election, and a rise in racist violence. The activism that met those crises was often organized wholly or partially online, sometimes by young people experimenting with creative new ways to build social movements.  My colleague Abby Ohlheiser spoke to four people in their 20s who, through the internet, became viral voices, key organizers, and vital resources over the past year. Read their stories.  This story is the last we'll share from the latest print edition of MIT Technology Review, all about change. Check out the full magazine, and if you want to get a copy of our next one, subscribe! It comes out at the end of August, it's going to be all about the mind, and it's going to be amazing."
2021-07-22 12:03:39+00:00,"  An albino opossum proves CRISPR works for marsupials, too    The news: CRISPR has been used to modify the genes of tomatoes, humans, and just about everything in between. Because of their unique reproductive biology and their relative rarity in laboratory settings, though, marsupials had eluded the CRISPR rush—until now. A team of researchers at Japan’s Riken Institute have used the technology to edit the genes of a South American species of opossum.  How they did it: The researchers used CRISPR to delete a gene that codes for pigment production. Targeting this gene meant that if the experiments worked, the results would be immediately obvious: the opossums would be albino if both copies of the gene were knocked out, and mottled, or mosaic, if a single copy was deleted. The resulting litter included one albino opossum and one mosaic opossum (pictured above).  Why it matters: The ability to tweak marsupial genomes could help biologists learn more about the animals and use them to study immune responses, developmental biology, and even diseases like melanoma. "
2021-07-21 12:05:27+00:00,"Space tourism is just getting started    What happened: Blue Origin founder Jeff Bezos successfully completed the company’s first crewed suborbital flight yesterday—a major step in its efforts to provide commercial space flights to paying customers. He was joined by his brother Mark, Dutch student Oliver Daemen and astronaut Wally Funk. Daemen and Funk became the youngest and oldest people to ever fly to space, respectively. The flight lasted just 10 minutes, but passed the Kármán line, the boundary between Earth’s atmosphere and outer space. It was a test of the company’s reusable rocket and capsule system New Shepard.  What’s next: Compared with the launch earlier this month of Virgin Galactic’s SpaceShipTwo, a type of spaceplane, Bezos’s trip was more reminiscent of a NASA mission, with a vertical takeoff, parachutes, and a soft landing. Together, the flights signify the start of commercial space tourism. Beyond getting humans closer to orbit, both Virgin Galactic and Blue Origin could advance new approaches to faster cross-continental travel, since both vehicles can reach speeds four to five times those of a regular airplane. "
2021-07-21 12:05:27+00:00,"  Why Facebook can never fix itself  Facebook’s problems are well-known by now: the Cambridge Analytica scandal, the genocide in Myanmar, and rampant covid misinformation are just several examples.  But An Ugly Truth, a new book about Facebook written by veteran New York Times reporters Sheera Frenkel and Cecilia Kang, argues that Facebook’s issues today are not the product of a company that lost its way. Instead they are part of its very design, built atop Zuckerberg’s narrow worldview, the careless privacy culture he cultivated, and the staggering ambitions he chased with Sandberg. Read our review of the book.  —Karen Hao  Disability rights advocates are worried about discrimination in AI hiring tools  Your ability to land your next job could depend on how well you playone of the AI-powered games that companies like AstraZeneca and Postmates are increasingly using in the hiring process. Some companies that create these games, like Pymetrics and Arctic Shores, claim that they limit bias in hiring.  But AI hiring games can be especially difficult to navigate for job seekers with disabilities. In the latest episodeof MIT Technology Review’s podcast “In Machines We Trust,” we explore how AI-powered hiring games and other tools may exclude people with disabilities. Listen to it on Apple Podcasts, Spotify, or wherever you get your podcasts. "
2021-07-20 12:05:05+00:00,"What the latest Pegasus spyware leaks tell us    The news: Over the weekend, a consortium of international news outlets published their findings from an investigation into the use of Pegasus, the marquee spyware product of the secretive billion-dollar Israeli surveillance company NSO Group. (Its CEO, Shalev Hulio, is pictured above.) The reports are based on a leak of tens of thousands of phone numbers that appear to have been targeted by Pegasus. The outlets were able to use the data to establish that journalists and activists in many countries were targeted—and in some cases successfully hacked.  The significance: The leaks indicate the scope of what cybersecurity reporters and experts have said for years: that while NSO Group claims its spyware is designed to target criminals and terrorists, its actual applications are much more broad. The NSO used its standard line for the latest leak, denying all allegations. But it has also argued that it can’t be held responsible if governments misuse the technology it sells them. "
2021-07-20 12:05:05+00:00,"  Cities are scrambling to prevent flooding  What’s happening: US cities are working to shore up their flood defensesin the face of climate change. Floods have hit New York, Detroit, and Flagstaff, Arizona, in recent weeks. In Germany and Belgium, they have swept away whole towns and left over 1,000 people missing.  A problem: Urban centers are more prone to flooding than other areas because water can’t seep into the ground the way it would in a forest or grassland. Instead, it flows. Stormwater infrastructure around the country is aging, and many governments have resorted to Band-Aid solutions instead of building more resilient systems.  What we need: Coastal cities face even more dire climate threats, and some are investing aggressively to stave them off. Beyond pump stations, cities are installing features like storm ponds and rain gardens to help manage flooding. "
2021-07-19 12:05:12+00:00,"Why England’s sudden lifting of covid restrictions is a massive gamble    England is about to take a huge gamble.  From today, the country is ditching all its remaining pandemic-related restrictions. People will be able to go to nightclubs, or gather in groups as large as they like. They will not be legally compelled to wear masks.  At the same time, coronavirus cases are rapidly rising in the UK. It recorded over 50,000 new cases on Friday, a figure that could breach 100,000 before long.  In theory, a full reopening during a surge in cases sounds like a combustible mix. But the UK government is betting that this time won’t be like the others because of its vaccination program.  Researchers say it’s extremely difficult to predict what will happen next, with multiple overlapping, complex factors at play. Here is what we know, what we don’t know, and what we need to keep an eye on over the coming weeks. "
2021-07-19 12:05:12+00:00,"  Is 57 a prime number? There’s a game for that.  A prime number is a whole number that can only be divided by 1 and itself.  Prime numbers are useful in computing—such as with error-correcting codes and encryption. But while finding which prime numbers multiply together to make the original number (known as prime factorization) is hard (hence its value in encryption), checking whether a number is prime is easier, if tricky. British mathematician Christian Lawson-Perfect made a game to test yourself doing this.  The aim of the game is to sort as many numbers as possible into “prime” or “not prime” in 60 seconds. Give it a whirl.  —Siobhan Roberts  Why it’s so hard to make tech more diverse  In 2017, Tracy Chou was working to expose Silicon Valley’s diversity issues. As an engineer at Pinterest, she’d published a widely circulated blog post calling for tech companies to share data on how many women worked on their engineering teams. She collected their responses in a public database that revealed how homogeneous many technical teams at top companies still were.  About a year later, Chou started a company called Block Partythat targets online harassment by giving Twitter users more control over which tweets appear in their feed and mentions. The service signed up its first paying customers in January.  With her new company, Chou wants to fix some of the problems she’s experienced firsthand in the tech industry—including the sort of online harassment of which she has been a target. Read our full interview with Chou.  —Wudan Yan  This interview is from the latest print edition of MIT Technology Review, all about change. Check it out, and subscribeto read the full thing (and receive future issues!) "
2021-07-16 12:07:16+00:00,"How to mend your broken pandemic brain    Americans are slowly coming out of the pandemic, but as they reemerge, there’s still a lot of trauma to process. It’s not just our families, our communities, and our jobs that have changed; our brains have changed too. We’re not the same people we were 18 months ago.  During the winter of 2020, more than 40% of Americans reported symptoms of anxiety or depression, double the rate of the previous year. That number dropped to 30% in June 2021 as vaccinations rose and covid-19 cases fell, but that still leaves nearly one in three Americans struggling with their mental health. In addition to diagnosable symptoms, plenty of people reported experiencing pandemic brain fog, including forgetfulness, difficulty concentrating, and general fuzziness.  Now the question is, can our brains change back? And how can we help them do that? "
2021-07-16 12:07:16+00:00,"  Why it's so hard to change  Throughout the decades, change has proved difficult—whether you’re trying to make it happen or just reacting to it, as previous issues of MIT Technology Review demonstrate. One story from 1967 claims that resistance to change is mostly borne out of anxiety and self-protection, another from 1971 argues that most broad programs of social change fail, and an article from 1994 articulates anxieties of the time about the coming explosion in internet connectivity. Read about them all, and check out the whole edition of the latest print magazinewhile you’re at it—all about (what else?) change. "
2021-07-15 12:07:24+00:00,"Welcome to the Tokyo Olympics, where public health, money, and politics collide    What’s happening: The Olympic and Paralympic games are set to begin on July 23 in Tokyo. The backdrop is far from ideal. Covid-19 cases are rising in Tokyo, prompting the city to announce its fourth state of emergency since the start of the pandemic. The rising caseload is especially troubling because the country’s vaccination rate remains low. Just 18% of Japan’s population is fully vaccinated. Nevertheless, the International Olympic Committee is pressing on. At stake are billions of dollars in sunk costs, as well as billions more in potential revenue.  What’s next: Experts worry that the influx of 100,000 people during the games could worsen covid-19 in Japan, despite the safety measures. They will be tested at various intervals, and required to download a contact tracing app. There won’t be any audiences at all at venues in and around Tokyo. Despite this, the Olympics could have a ripple effect on covid cases in the country. Perhaps it’s no surprise, then, that polls show more than 80% of Japanese people don’t want the games to happen at all. "
2021-07-15 12:07:24+00:00,"  Facebook is ditching plans to make brain-reading headsets  The news: Facebook has announcedit is discontinuing a project launched in 2017 to build a headset or headband that would allow people to send text messages by thinking. It said consumer brain-reading remains very far off, and it will instead focus on an experimental wrist controller for virtual reality that reads muscle signals in the arm.  The bigger picture: There’s still a craze around brain-computer interfaces more generally. That’s because companies see mind-controlled software as a huge breakthrough—as important as the computer mouse, graphical user interface, or swipe screen.  Woah there: As brain-computer interfaces advance, there are serious new concerns. What would happen if large tech companies could know people’s thoughts? Given Facebook’s poor record on privacy, the decision to halt this research may have the side benefit of putting some distance between the company and rising worries about “neurorights.” "
2021-07-14 12:07:59+00:00,"The lurking threat to solar power’s growth    The problem: Solar power faces a fundamental challengethat could halt the industry’s breakneck growth. Simply put: the more solar you add to the grid, the less valuable it becomes. The problem is that solar panels generate lots of electricity in the middle of sunny days, frequently more than what’s required, driving down prices—sometimes even into negative territory. And solar plant operators can’t easily throttle electricity up and down as needed.  How it’s manifesting: A new report has concluded that California is already experiencing this phenomenon, known as solar value deflation. The state’s average solar wholesale prices have fallen 37% relative to the average electricity prices for other sources since 2014, according to the Breakthrough Institute analysis. It could soon become a broader problem around the world.  Why it matters: Lower prices may sound great for consumers. But it presents troubling implications for the world’s hopes of rapidly expanding solar capacity and meeting climate goals. "
2021-07-14 12:07:59+00:00,"  The world’s biggest ransomware gang just disappeared from the internet  The news: One of the most prolific ransomware gangs in the world suddenly disappeared from the interneton Tuesday morning. The ransomware crew known as REvil is responsible for a whopping 42% of all recent ransomware attacks, but they're known for two hacks in particular: the one on Kaseya earlier this month, and the attack on meat supplier JBS.  Why now? There are a few possible explanations. First, the gang itself may have chosen to retire if they’ve made enough money or felt too much pressure. The United States or its allies may have taken them offline. Or the Russian government, under international scrutiny, may have forced them to shut down. Their disappearance could also be temporary.  Interesting timing: The unexplained exodus came just one day before senior officials from the White House and Russia are scheduled to meet to discuss the global ransomware crisis. "
2021-07-13 12:07:42+00:00,"Here’s what we know about kids and long covid    The risk to children: When it comes to covid, kids have largely been spared. They can get infected and spread the virus, but they have little risk of becoming seriously ill or dying. Yet, just like adults, they can have symptoms that persist well beyond the initial infection. This condition is often referred to as “long” covid. Symptoms in kids mirror those seen in adults: fatigue, muscle and joint pain, headache, loss of taste or smell, respiratory problems, chest tightness or pain, and heart palpitations.  What we know: Even in countries with high vaccination rates, the virus is still circulating among children, the vast majority of whom are either yet to be vaccinated, or ineligible for vaccination. There are only a handful of studies to draw on for kids and long covid, but data from the UK suggests that 10-13% of kids who test positive for covid have symptoms for more than five weeks. Rates from studies in other countries are lower.  What we don’t know: Lots! We don’t know what causes long covid. And we don’t know which kids are more susceptible to it either, although there’s some indication that older kids are at greater risk. There are some anecdotal reports suggesting that vaccination can help to curb long covid, but there’s no data specific to children yet. "
