date,text
2021-08-20 12:03:39+00:00,"Afghanistan’s looming cash crisis could worsen a humanitarian disaster    Afghanistan’s banking system is in a state of collapse, and people there are running out money. This cash crisismeans many Afghan citizens lack access to important services, as the UN warns of a growing humanitarian disaster.  Asef Khademi, who was previously working to modernize the country’s financial systems, is one of the many people now hiding in Kabul who wants to leave Afghanistan, but his hope is waning fast.  Khademi is afraid because for the last few years he has been working for an internationally-funded project to bring digital currency and banking into people’s lives, called the Afghanistan Payments System, or APS.  It was an important project: the Afghan economy runs on cash, and only 10-15% of citizens have a bank account. APS was meant to help Afghanistan become less cash-dependent. And, says Khademi, it was moving fast before the US withdrew its forces and the Taliban took over.  Now, though, as chaos continues to unfold in Afghanistan, the project has stopped, and cash is running out before any viable alternatives have been put in place.  But a different outcome was within reach, Khademi says: Afghanistan was perhaps just a year or two away from having a 21st-century digital banking infrastructure that could cope even if cash disappeared. "
2021-08-19 12:03:12+00:00,"How the world already prevented far worse warming this century    An impressive achievement: The world has already banded together to enact an international treaty that prevented significant global warming this century—even though that wasn’t the driving goal.  The specifics: In 1987, dozens of nations adopted the Montreal Protocol, agreeing to phase out the use of substances that were breaking down the ozone layer. But since many of them are also powerful greenhouse gases, as a major side benefit, their reduction over the last three decades has already eased warming and could cut as much as 1˚C off worldwide average temperatures by 2050.  More good news: A new studyin Nature highlights yet another crucial, if inadvertent, bonus: reducing the strain that ultraviolet radiation from the sun puts on plants, inhibiting photosynthesis and slowing growth. The Montreal Protocol avoided a catastrophic collapse of forests and croplands that would have added hundreds of billions of tons of carbon to the atmosphere.  Lessons to learn? All of which poses a question: Why can’t the world enact a similarly aggressive and effective international treaty designed explicitly to address climate change? "
2021-08-19 12:03:12+00:00,"  Solar panels are a pain to recycle. These companies are trying to fix that.  Vast wastage: Millions of solar panels have been installed in the last two decades—and since they typically last between 25 and 30 years, many will soon be ready for retirement and probably headed to a landfill. Only about 10% of panels in the US are recycled—it isn’t mandated by federal regulations, and recycling the devices is currently much more expensive than just discarding them.  A recycling push: New efforts to recycle these panels could reduce both the amount of waste and the new material that needs to be mined. The materials in solar panels coming offline each year could be worth an estimated $2 billion by 2050. New efforts, including one approach from a French startup called ROSI, are trying to recapture these valuable materials, especially silver and silicon, to make recycling the panels more financially viable. "
2021-08-18 12:04:31+00:00,"There's a vast online effort underway to evacuate vulnerable Afghans    A mad scramble: The sudden collapse of Afghanistan's government has led to a frantic push to accelerate online relief and evacuation efforts. These attempts, organized largely via Google Forms, WhatsApp and private social media groups, are trying to fill the void left by the US government's failure to protect vulnerable Afghans. These include journalists, activists, academics, translators, and others.  What’s happening: Working largely online, informal networks of people in and outside the country have been organizing lists of Afghans eligible for different resettlement programs or even trying to bypass the slow-moving bureaucratic processes completely. Several groups were planning to charter planes for private airlifts, for example.  The danger: These efforts create their own set of risks—including risks to the safety and security of people’s vital personal information. You can’t always be sure who you’re interacting with, and it’s possible that the Taliban could be lurking in the same online spaces too. "
2021-08-18 12:04:31+00:00,"  Apple says researchers can vet its child safety features. But it’s suing a startup that does just that.  Questionable promises: When Apple announced new technologythat will check its US iCloud service for known child sexual abuse material, it was met with fierce criticism over worries that the feature could be abused for government surveillance. Faced with public resistance, Apple insisted that its technology can be held accountable. In an interview, an executive insisted that researchers can inspect what’s happening in its iOS phone software.  But, uh… Apple is suing a company that makes software to let security researchers do exactly that. In 2019 it filed a lawsuit against Corellium, which lets researchers cheaply and easily test mobile devices by emulating their software rather than requiring them to access the physical devices. In the lawsuit, Apple arguedthat Corellium violated its copyrights, enabled the sale of software exploits used for hacking, and shouldn’t exist. The startup countered by saying that its use of Apple’s code was a classic protected case of fair use. The judge has largely sided with Corellium so far. "
2021-08-17 12:02:54+00:00,"How to talk to vaccine-hesitant people    It’s been eight months since the vaccine rollout began in the US, yet one in three adults remain unvaccinated. But they're not all firmly anti-vaccine, and many may be open to persuasion. With the delta variant ripping through many communities, getting vaccinated matters more than ever. So how do you change minds?  My colleague Tanya Basu has some tips: * Check your biases. People are complicated, and their reasons for not getting the vaccine are personal. Respect those reasons and you might have a more productive conversation. * See if the person is open to the conversation. If not, it might be a better use of your time and energy to simply back away. * Be kind. The person you are trying to communicate with will shut you out immediately if you are disrespectful. * Identify the obstacle. Ask if there’s anything you can do to ease their burden or help eliminate any barriers. * Consider the humble text message. Confrontations on social media rarely work. * Tailor your argument to the person. Consider their specific worries and try to address them. Don’t use jargon or talk down. * Be a “cooler.” People who have had similar concerns, yet gone ahead and got vaccinated, may be more likely to persuade others than someone eager to get their shot at the first opportunity. * Have your sources ready. Present facts in a clear way that isn’t condescending. "
2021-08-16 12:03:34+00:00,"How digital beauty filters perpetuate colorism    When Lise was a young teenager in Georgia, her classmates bullied her relentlessly. Most often, they would attack her with remarks about her dark complexion. Sometimes teachers would send her home from school because she couldn’t stop crying.  And it wasn’t just white classmates. Black students harassed her too. She remembers them asking, “Why is she so dark?”  Just when she thought it couldn’t get worse, the phone in her palm became an endless stream of pictures of beautiful, lighter-skinned women getting dozens, hundreds, or even thousands of likes and affirming comments.  The prejudice Lise experienced—colorism—has a long history, driven by European ideals of beauty that associate lighter skin with purity and wealth, darker tones with sin and poverty.  These prejudices have been part of the social and media landscape for a long time but today, thanks to the prevalence of selfies and face filters, digital colorism has spread. With Snapchat, Instagram, TikTok, and Facebook a part of billions of people’s everyday lives, many of us find that people see far more pictures of us than ever before. But there are biases built into these systems, and they could be particularly catastrophic for women with darker complexions. "
2021-08-13 12:04:06+00:00,"Stop saying “delta plus.” It doesn’t mean anything.    If you’ve been worried by recent news stories about a strain of covid called “delta plus,” it may freak you out to hear that scientists just expanded the delta family from four variants to 13.  Please take a deep breath. Scientists would really like you to understand that there’s no evidence delta has learned any new tricks, and these new names are for helping keep track of covid’s evolution—not nine new reasons to panic. And many researchers are also really, really hoping you’ll stop saying ‘delta plus.’ (  “The name ‘delta plus’ is completely incorrect, because it gives the perception that this will cause more damage,” says Anderson Brito, a member of the Pango Lineage Designation Committee, which assigns scientific names like B.1.1.7 to new branches of the virus. "
2021-08-13 12:04:06+00:00,"  Deleting unethical data sets isn’t good enough  A lingering problem: For years, AI researchers scraped the web for the images and text they need to train their models. Some of the data sets they created contain millions of photos of ordinary individuals who have never given their consent for their images to be used. The practice is now legally risky and frowned-upon. As a result, AI researchers have increasingly retracted the data sets they created this way. But the privacy concerns linger in an internet forever-land.  The specifics: A new studyshows that problematic data is still widely proliferating and being used. The authors selected three of the most cited data sets containing faces or people, two of which had been retracted; they traced the ways each had been copied, used, and repurposed in close to 1,000 papers. They found that many still exist on third-party sites and in derivative data sets built atop the original. Part of the problem, according to the paper, is that those who put together data sets quickly lose control of their creations.  A fix? The authors provide several recommendations for the AI community around responsible and ethical data collection and use. But some want to take it further. "
2021-08-12 12:01:27+00:00,"Mathematicians are deploying algorithms to stop gerrymandering    The maps for US legislative races often resemble monsters, with bizarrely shaped districts emerging from wonky hybrids of counties, precincts, and census blocks.  But it’s the drawing of these maps, more than anything, that determines how votes translate into who gets elected.  The question is, if the choice of maps is so important, which map should we choose, and how should we decide if someone has done a good job in choosing that map?  Over recent months, mathematicians have been busyin anticipation of a data release expected today from the US Census Bureau. Every decade, new census data launches the decennial redistricting cycle—state legislators (or sometimes appointed commissions) draw new maps, moving district lines to account for demographic shifts.  In preparation, mathematicians are sharpening new algorithms that detect and counter gerrymandering, whereby politicians rig the maps and skew the results to favor one political party over another. Republicans have openly declared that they intend to gerrymander a path to retaking the US House of Representatives in 2022. Tools like these algorithms will play a critical role in the looming political battles. "
2021-08-11 12:03:47+00:00,"The big tech quest to find the metals needed for the energy overhaul    ​​In recent weeks, every day that the weather permitted, a helicopter contracted by KoBold Metals flew over a remote part of northern Quebec carrying some unusual cargo.  A 115-foot-wide copper coil dangled from the belly of the craft, sending electromagnetic waves into the earth and creating currents in rocks deep underground. Any good electrical conductors sent telltale signals back to a receiver coil, suggesting that the rocks might contain valuable deposits of nickel and cobalt—metals used in the batteries powering cell phones, laptops, and electric cars, demand for which is expected to soar in the coming years.  The data collected is plugged into machine-learning models which advise the team on the best places to survey next. It’s a far cry from how geologists have traditionally hunted for mineral deposits. These days, data science and machine learning are becoming a bigger part of the effort to find the next big payday underground. "
2021-08-11 12:03:47+00:00,"  Chinese hackers disguised themselves as Iran to target Israel  The news: When hackers broke into Israeli computers in 2019 and 2020, evidence initially suggested they were from Iran. But on closer inspection, analysts concluded it was conducted by Chinese operatives posing as a team from Tehran, according to new research from American cybersecurity firm FireEye.  How they did it: Many of their tactics were blunt, such as using the word ""Iran"" in file paths. But they also wrote in Farsi, and deployed tools normally associated with Iranians. The attackers also took pains to protect their true identities by minimizing the evidence they left behind, and hiding the infrastructure they used to break into Israeli machines. Ultimately they failed. The hackers made several mistakes that blew their cover and linked them back to their previous work. For example, they used similar files, infrastructure, and tactics across multiple operations in the Middle East.  The significance: The attack was not particularly sophisticated or successful, but it shows how important attribution—and misattribution—can be in cyber-espionage campaigns. "
2021-08-10 12:03:10+00:00,"What we know about how the delta variant of covid is spreading    What’s happening: Covid cases in the US have doubled over the past two weeks, and scientists are now racing to understand the delta variant, which appears to account for the vast majority of new infections.  What we know: The delta variant is nearly twice as contagious as previous versions of the virus, according to the CDC. It also seems to lead to higher viral loads. The evidence suggests that vaccinated people may be able to transmit the virus, perhaps even just as readily as unvaccinated people. The overwhelming majority of infections are still in unvaccinated people. So far, it looks as if vaccines still largely work, especially in preventing severe illness.  What we don’t know: The appearance of a new variant has people worried we’ll see other, even worse variants. There is some genuine cause for concern: viruses mutate all the time, so as long as there are places in the world where there’s unchecked spread, we’ll likely continue to see more variants that will behave differently. The solution is to increase vaccination rates, and fast. "
2021-08-10 12:03:10+00:00,"  The UN climate report pins hopes on carbon removal technologies that barely exist  The news: The UN’s long-awaited climate report, released yesterday, offered a stark reminder that removing massive amounts of carbon dioxide from the atmosphere will be essential to prevent the gravest dangers of global warming. But it also underscored that the necessary technologies barely exist—and will be tremendously difficult to deploy.  The specifics: The report found that greenhouse gases are likely to drive worldwide temperatures at least 1.5˚C above preindustrial conditions within the next 20 years, fueling severe heat waves, floods, and droughts. Once that happens, carbon removal is essentially the only way to bring the climate back to a safer zone, because the greenhouse gas persists for hundreds to thousands of years in the atmosphere.  A rosy view: The model used to create the most optimistic scenario in the report, which limits warming to 1.5˚C, assumes the world will create a brand-new carbon-sucking sector operating on the emissions scales of all America’s cars, power plants, planes, and factories, in the next 30 years or so. But much of the technology that would underpin it has only ever been proven in small-scale projects. "
2021-08-09 12:03:33+00:00,"Apple has defended its new anti-child-abuse tech against privacy concerns    What’s happening: Last week, Apple announced new technologiesto detect child sexual abuse material on iPhones. Apple says the new detection tool, called NeuralHash, can identify images of child abuse stored on an iPhone without decrypting the image. It says it has implemented multiple checks to reduce the chance of errors before the images are passed onto the authorities. The tool will roll out in the US this year.  The reaction? The controversial new features strike at the heart of concerns about privacy, surveillance, and tech-enabled crimes. Apple says these new features preserve privacy as they combat child abuse. For critics, though, the biggest question is not about what the technology might do today; it’s about what it could become tomorrow.  What’s next? There is an enormous amount we don’t know about what Apple is doing. An optimist would say that enabling full encryption of iCloud accounts while still detecting child abuse material is both an anti-abuse and privacy win. A realist would worry about whether this feature will be weaponized by governments for broadening surveillance. "
2021-08-06 12:11:45+00:00,"The $1 trillion infrastructure bill is a baby step toward the US grid we need   The problem: The US needs to add hundreds of thousands of miles of transmission lines in the coming decades. The lines would weave together fragmented regional power systems into an interconnected grid capable of supporting a massive influx of renewables.  Tell me more: A national network of short spur lines and long-distance, high-voltage wires would deliver wind, solar and hydroelectric power to where it’s needed when it’s available across the country.  Yay, great let's do it: Not so fast. For starters, it could cost hundreds of billions of dollars to build out the necessary power lines this decade alone. And states, counties, cities and towns across the nation would need to quickly sign off on a multitude of new transmission lines. Unfortunately, the US is terrible at permitting such multi-state projects.  But hang on, is that hope? The roughly $1 trillion infrastructure packagemoving forward in the Senate, which has bipartisan support, provides billions of dollars for transmission lines. "
2021-08-05 12:04:01+00:00,"Stop giving out booster shots until more of the world is vaccinated, says the WHO    The WHO has called for a halt to any booster vaccinations until the end of September, so that other places in the world can get their first shots.  The agency’s director-general, Tedros Adhanom Ghebreyesus, said that while high income countries have given almost 100 shots for every 100 people, poorer countries have managed just 1.5 per 100 people. 80% of the 4 billion vaccines doses administered so far have been in high income countries.  ""We cannot accept countries that have already used most of the global supply of vaccines using even more of it, while the world’s most vulnerable people remain unprotected,” he told a press conference.  He said a moratorium on boosters until the end of September would enable at least 10% of every country to get vaccinated.  The WHO’s latest intervention comes as a number of countries have started, or are considering rolling out, booster shots. Israel began administering third shots last month, and France, Germany and the UAE have all announced plans to begin a booster program. Others, like the UK and the US, are still considering it. But the science on whether boosters are even required is still uncertain. "
2021-08-05 12:04:01+00:00,"  New global map shows populations are growing faster in flood-prone areas  The news: Even as climate change and urbanization make floods more frequent and their consequences more severe, a higher proportion of people are living in areas that experience them.  How we know: In a new studypublished this week in Nature, satellite images were used to map over 900 flood events that occurred between 2000 and 2018, affecting between 255 million and 290 million people.  The population in these areas increased by 34.1% over the same period (the global population only grew by 18.6%). That means between 58 million and 86 million more people were exposed to flooding in those places.  Why it matters: The effort gives scientists a clearer picture of the scale and human impact of recent floods. Getting a more accurate picture of global flood risk might help steer funding for climate adaptation to the places that need it most. "
2021-08-04 12:03:44+00:00,"What you need to know about New York City’s new vaccine proof    The news: New York City will be the first city in the US to require proof of vaccination to enter a variety of indoor places, the city’s mayor announced yesterday. The so-called Key to NYC Pass (which, rather confusingly, is a program, not an actual pass) is part of a suite of efforts to fight the more-transmissible delta variant, as cases rise across the city.  What that means: To see a Broadway show, eat indoors at a restaurant, or use a gym, you’ll need to show proof that you’ve received at least one dose of a covid vaccine. (It won’t be needed for essentials, like grocery shopping.) Acceptable proof will include the state’s Excelsior Pass (which has faced a range of glitches and fairness concerns), as well as a new app released by the city, NYC Covid Safe. The requirement applies to both customers and employees of those places.  Why it’s happening: About 66% of the city’s adults are fully vaccinated, and officials hope the new requirements will convince more people to get the shots. "
2021-08-04 12:03:44+00:00,"  Looking for work? Here’s how to write a résumé that an AI will love.  From job-matching platforms to AI-powered games and interviews, companies are relying more and more on artificial intelligence to streamline the hiring process.  In the final episode of Season 2of our podcast In Machines We Trust, we take a look at how algorithms are screening out applicants by the millions, based on little more than what they see in your resume. But there are ways to help you play by—and in some cases bend—their rules to give you an edge.  We asked career and job-matching experts for practical tips.Read how you can improve your chances. (  —Sheridan Wall and Hilke Schellman  You can listen to the podcast here on Apple Podcastsbut it’s also available at all the usual places. Here is the transcript. "
2021-08-03 12:03:36+00:00,"The voices of women in tech are still being erased    In the middle of the night on May 24, TikTok changed its voice. The ubiquitous woman’s voice that could read your video’s text out loud in a slightly stilted, robotic cadence was suddenly replaced by one with an almost smirky, upbeat tone. Many users started calling the new one the “Uncanny Valley Girl” to express their displeasure. Lil Nas X even made a TikTok about it.  But what happened to the old voice? And who was the woman behind it?  Women's voices and bodies can be found all throughout the history of computing—from being heard in launch countdownsto being visible in photographs—but only relatively recently have historians written these women back into the narrativeby explaining what they did. For a long time, women were mistakenly thought to be peripheral to computing history, even though they were often the ones who programmed the computers.  And it is still the case that when we hear a woman’s voice as part of a tech product, we might not know who she is, whether she is even real, and if so, whether she consented to have her voice used in that way.  Many TikTok users assumed that the text-to-speech voice they heard on the app wasn’t a real person. But it was: it belonged to a Canadian voice actor named Bev Standing, and Standing had never given ByteDance, the company that owns TikTok, permission to use it. "
2021-08-02 12:04:40+00:00,"Covid clusters among the vaccinated are killing our back-to-normal dreams    What’s happening: A handful of recent cases are proving that covid-19 transmission chains and superspreading events can occur even in groups where nearly everyone is vaccinated.  In the US: Investigators are learning from one particular outbreak in Provincetown, Massachusetts, a seaside town on Cape Cod, which in early July hosted a rowdy parade and crowded weeks of pool parties. Since then, health investigators say, there have been more than 800 cases of covid-19 linked to those events, 74% of which are in people who were vaccinated.  Viral loads: The Provincetown outbreak was caused by the delta variant, which now accounts for most cases in the US. The CDC said the “pivotal discovery” was that vaccinated people infected with delta in Provincetown appear to have just as much virus in their systems as those who are unvaccinated.  What it means: This suggests a rapid return to a layered approach of countermeasures, including masks and social distancing, which could also complicate school reopenings starting next month in the US. "
